{
  "$schema": "../schemas/campaign-execution-policy.schema.json",
  "schemaVersion": "1.0.0",
  "id": "campaign-execution",
  "status": "accepted",
  "authority": "Architect",
  "policy_version": "1.5.0",
  "plan_schema": "law/schemas/campaign.schema.json",
  "containment": {
    "levels": ["campaign", "round", "wave", "task"],
    "cardinality": "every-level-has-exactly-one-parent",
    "campaign_holds": "an ordered set of rounds implementing an explicit set of accepted decision records",
    "round_holds": "the smallest set of waves that can close with one attestation decision and one merged head",
    "wave_holds": "one coupled task group: exactly one architect, one inspector, and one engineer task in pipeline order, or one single-role task",
    "task_holds": "one role, one session, one branch, one pull request, one boundary",
    "cross_round_dependency": "forbidden-between-waves-and-tasks; only rounds depend on rounds",
    "record_coverage": "every record listed on the campaign appears on at least one round and every round record appears on at least one of its waves",
    "runtime_state": "this document is a plan and ledger; runtime state lives in governed round and task records"
  },
  "identity": {
    "campaign": "^CMP-[0-9]{4}$",
    "round": "^R-[0-9]{4}$",
    "wave": "^CTG-[0-9]{4,}$",
    "task": "^TASK-[0-9]{4,}$",
    "uniqueness": "campaign-wide-for-rounds-waves-and-tasks",
    "allocation": "round ids are allocated from the campaign number times one hundred plus the round ordinal; wave and task ids are allocated from .devai/state/counters.json when materialized and may be pre-allocated in the plan",
    "collision_with_governed_records": "a plan id that already exists under work/rounds or .devai/state/tasks is a load error"
  },
  "ordering": {
    "rounds": "depends_on-partial-order; a round opens only when every round it depends on is closed",
    "rounds_without_dependency_between_them": "may-run-concurrently",
    "waves_within_round": "depends_on-partial-order then id-utf8-ascending",
    "waves_with_overlapping_lock_scopes": "serialized-by-id-utf8-ascending",
    "tasks_within_wave": "coupled-pipeline-position-ascending: architect, inspector, engineer",
    "position_authority": "law/constitution.md#article-24-coupled-task-triplets",
    "merge_order": "architect, inspector, engineer; each downstream branch rebases after the upstream merge",
    "branch_creation": "architect from integration head; inspector from architect head; engineer from inspector head"
  },
  "lifecycle": {
    "campaign": {
      "initial": "proposed",
      "terminal": ["closed", "abandoned"],
      "transitions": [
        {
          "from": "proposed",
          "to": ["accepted", "abandoned"],
          "when": "the mandate holder approves the plan, or withdraws it"
        },
        {
          "from": "accepted",
          "to": ["active", "abandoned"],
          "when": "the first round opens, or the mandate is withdrawn"
        },
        {
          "from": "active",
          "to": ["closed", "abandoned"],
          "when": "every round is closed, or the mandate is withdrawn with at least one round not closed"
        }
      ],
      "undeclared_transition": "CAMPAIGN_TRANSITION_FORBIDDEN"
    },
    "round": {
      "initial": "planned",
      "terminal": ["closed", "abandoned"],
      "transitions": [
        {
          "from": "planned",
          "to": ["open", "abandoned"],
          "when": "the round open gate holds, or the campaign is abandoned"
        },
        {
          "from": "open",
          "to": ["closing", "abandoned"],
          "when": "every task in every wave is merged or cancelled with at least one merged, or the campaign is abandoned"
        },
        {
          "from": "closing",
          "to": ["closed", "open"],
          "when": "the round close gate holds, or a close check fails and a task is reopened to correct it"
        }
      ],
      "undeclared_transition": "CAMPAIGN_ROUND_TRANSITION_FORBIDDEN"
    },
    "wave": {
      "initial": "planned",
      "terminal": ["merged", "cancelled"],
      "transitions": [
        {
          "from": "planned",
          "to": ["open", "cancelled"],
          "when": "its round is open and every wave it depends on is merged and no open wave shares a lock scope, or the round is abandoned"
        },
        {
          "from": "open",
          "to": ["merged", "cancelled"],
          "when": "its last task in pipeline order is merged, or the round is abandoned"
        }
      ],
      "undeclared_transition": "CAMPAIGN_WAVE_TRANSITION_FORBIDDEN"
    },
    "task": {
      "initial": "planned",
      "terminal": ["merged", "cancelled"],
      "transitions": [
        {
          "from": "planned",
          "to": ["ready", "cancelled"],
          "when": "its wave is open and its upstream task is merged or it has no upstream, or the wave is cancelled"
        },
        {
          "from": "ready",
          "to": ["in_progress", "cancelled"],
          "when": "a human opens a session with the task discipline declared and the prompt sha256 is pinned"
        },
        {
          "from": "in_progress",
          "to": ["checkpoint", "pre_merge", "blocked", "cancelled"],
          "when": "the session emits a checkpoint, opens the pull request with acceptance commands passing, reports a gap that needs another role, or is withdrawn"
        },
        {
          "from": "checkpoint",
          "to": ["in_progress", "pre_merge", "blocked"],
          "when": "work resumes, the pull request is opened, or a gap is reported"
        },
        {
          "from": "pre_merge",
          "to": ["merged", "in_progress"],
          "when": "the pull-request gate is green, under review.mode model-advisory the task carries a recorded review block whose verdict validates and whose reply digest matches, and a human ratifies and merges; or review requests a change"
        },
        {
          "from": "blocked",
          "to": ["ready", "cancelled"],
          "when": "the gap is resolved by the responsible role, or the task is withdrawn"
        }
      ],
      "undeclared_transition": "CAMPAIGN_TASK_TRANSITION_FORBIDDEN"
    }
  },
  "gates": {
    "round_open": [
      "every record on the round has status accepted",
      "every round in depends_on is closed",
      "every task boundary path is inside the constitution authority row of its discipline"
    ],
    "wave_open": [
      "the round is open",
      "every wave in depends_on is merged",
      "no open wave in the round shares a lock scope prefix"
    ],
    "task_start": [
      "the upstream task is merged or the task is the architect position",
      "the prompt file sha256 is recorded on the task",
      "the session role equals the task discipline",
      "the tier map is resolved from law/policy/model-tiers.json merged with the campaign models override and pinned on the task as execution.resolved with the default policy_version"
    ],
    "task_pre_merge": [
      "every acceptance command exits zero on the branch head",
      "every wave gate check member passes on the branch head",
      "every commit on the branch satisfies the commit rules below",
      "the diff touches only boundary paths",
      "under serialized admission, no other pull request targeting the integration branch is in pre_merge",
      "under review.mode model-advisory, the advisory verdict, the SHA-256 of the reply it was extracted from, the evaluator, and the time are recorded on the task before the human ratifies"
    ],
    "round_close_universal": [
      "adrs",
      "schemas",
      "docs-links",
      "format:check:all",
      "action-registry:check"
    ],
    "round_close": [
      "every task is merged or cancelled",
      "the universal close checks and the round close_checks pass on the merged head",
      "every Owner effect in owner_effects_required carries performed_at, with either outcome: performed, the default when outcome is absent, or fallback, when the effect was resolved by the fallback its description names and performed_at records when that fallback was recorded; an effect whose required_before names the round and lacks performed_at is owner-effect-not-performed and the round cannot close",
      "when attestation_reissue is true, the new task-policy digest is recorded in closure and the attestation is re-issued for it before any release plan uses the head"
    ],
    "review": {
      "steps": {
        "model_evaluation": {
          "performer": "model",
          "delegable": true,
          "where": "inside the human-initiated orchestrator session, by a model instance distinct from the working agent of the task (law/constitution.md Article 18)",
          "output": "an advisory verdict in the shape law/schemas/review-verdict.schema.json (ADR-MDL-0001) declares"
        },
        "gate_ratification": {
          "performer": "human",
          "delegable": false,
          "where": "the ratifying human reads the advisory verdict, when one exists, and records the gate"
        },
        "merge": {
          "performer": "human",
          "delegable": false,
          "where": "the integration effect of law/constitution.md Article 28; a human role under ADR-GOV-0002"
        },
        "dispatch": {
          "performer": "human",
          "delegable": false,
          "where": "every remote effect is human, exact, and single-use as ADR-GOV-0012 and the authorization ledger require"
        }
      },
      "modes": {
        "human": "the default when review.mode is absent; no step is delegated and no task carries a review block",
        "model-advisory": "model_evaluation is delegated; the other three steps are unchanged; the campaign declares it in review.mode and every task in pre_merge carries the review block before the human ratifies"
      },